ID,Priority_Tier,Final_Score,High_Urgency_Flag,Lead_Score,Enhanced_Score,Intent_Signal,Freshness_Score,Size_Score,Proximity_Score,State,Proposal No.,Project Name,Project Proponent,Location,Sector,Category,Proposal Status,Recommended_Products,Submission_Year,Other Details,Project_Description,Officer_Name,Officer_Phone,Officer_Email,Officer_Address,Officer_Role,Officer_Distance_KM
409,Tier 2 - High Priority,55.1,False,95,38.0,0.3,0.1333333333333333,0.6,1.0,Uttar Pradesh,SIA/UP/MIN/565355/2026,"“Ordinary Sand Mining” from Riverbed of Ganga River at Village- Bara, Gata No.- 1255 क, Lease Area- 15.0 ha., Tehsil- Sevrai, District- Ghazipur, Uttar Pradesh, Project Proponent- M/s G D MINING PRIVATE LIMITED/524275 (Director- Manaswita Ghosh)",GEE DEE MINING PRIVATE LIMITED,UTTAR PRADESH,Non-Coal,B1,Under Verification,"Diesel, Lubricants, Transportation Fuel",2026,Category: B1 Sector: Non-Coal Mining Date of Submission: 13/01/2026,“Ordinary Sand Mining”,Retail Regional Manager - Lucknow,0522-2309581,lucknow.retrm@hpcl.in,"Plot No. 1, Nehru Enclave, Gomti Nagar, Lucknow, Uttar Pradesh - 226010",Retail Regional Manager,0.0
410,Tier 2 - High Priority,55.0,False,90,40.0,0.3,0.3333333333333333,0.4,1.0,West Bengal,SIA/WB/MIN/565948/2026,Taherpur Sand Mine,ALOK SEN,WEST BENGAL,Non-Coal,B1,Proposal Accepted and Referred to SEAC,"Diesel, Lubricants, Transportation Fuel",2026,Category: B1 Sector: Non-Coal Mining Date of Submission: 19/01/2026,"Applicant Alok Sen is the successful highest bidder of Sand Block No.: GALSI-II/TAHERPUR/1192(P)/A participating in sand block auction conducted by Government of West Bengal and will obtain sand mining lease after deed registration. The mining lease will be granted over an area of 3.78 Hectares/9.35 Acres on river Damodar at plot no: 1192(P), J.L. No.-088, Mouza: Taherpur, P.S. Galsi, District: Purba Bardhaman, State: West Bengal. Mine plan was prepared by Shri Pritam Kumar Saha (QP) and was app",Regional Manager - Kolkata,+91-9547535867,kolkata.retrm@hpcl.in,"2ND FLOOR, No-6, Church Lane, Bbd Bag, Kolkata-700001, West Bengal",Regional Manager,0.0
411,Tier 2 - High Priority,55.0,False,90,40.0,0.3,0.3333333333333333,0.4,1.0,West Bengal,SIA/WB/MIN/563696/2026,Sand and Stone Block – Patharhirhira Part II Sand and Stone Mine (Patharhirhira Part II),FALCON ABASAN PVT. LTD.,WEST BENGAL,Non-Coal,B1,Proposal Accepted and Referred to SEAC,"Diesel, Lubricants, Transportation Fuel",2026,Category: B1 Sector: Non-Coal Mining Date of Submission: 19/01/2026,"Patharhirhira Part II Sand and Stone Mine (Patharhirhira Part II) is situated at J. L. No. – 25, Plot No. 373, 374, 366, 367, 368, 363, 605, 604, 602, 97, 180. Mouza – Patharhirhira, Village – Patharhirhira, Police Station – Phansidewa, District – Darjeeling, State - West Bengal and it lies on Chenga River comprising an area of 4.90 Hectare (12.10 Acres). The block is having replenishable geological resource of riverbed materials consists of Sand, Gravel and Pebbles in a tune of around 5,24,300 ",Regional Manager - Kolkata,+91-9547535867,kolkata.retrm@hpcl.in,"2ND FLOOR, No-6, Church Lane, Bbd Bag, Kolkata-700001, West Bengal",Regional Manager,0.0
412,Tier 2 - High Priority,55.0,False,90,40.0,0.3,0.3333333333333333,0.4,1.0,West Bengal,SIA/WB/MIN/563691/2026,Sand and Stone Block – Patharhirhira Part I Sand and Stone Mine (Patharhirhira Part I),FALCON ABASAN PVT. LTD.,WEST BENGAL,Non-Coal,B1,Proposal Accepted and Referred to SEAC,"Diesel, Lubricants, Transportation Fuel",2026,Category: B1 Sector: Non-Coal Mining Date of Submission: 19/01/2026,"Patharhirhira Part I Sand and Stone Mine (Patharhirhira Part I) is situated at J. L. No. – 25, Plot No. 373, 374, 366, 367, 368, 363, 605, 604, 602, 97, 180 Mouza – Patharhirhira, Village – Patharhirhira, Police Station – Phansidewa, District – Darjeeling, State - West Bengal and it lies on Chenga River comprising an area of 4.90 Hectare (12.10 Acres). The block is having replenishable geological resource of riverbed materials consists of Sand, Gravel and Pebbles in a tune of around 5,24,300 cum",Regional Manager - Kolkata,+91-9547535867,kolkata.retrm@hpcl.in,"2ND FLOOR, No-6, Church Lane, Bbd Bag, Kolkata-700001, West Bengal",Regional Manager,0.0
413,Tier 2 - High Priority,55.0,False,90,40.0,0.3,0.1999999999999999,0.6,1.0,West Bengal,SIA/WB/MIN/543089/2026,Kotsimul Sand Mine Maa Tara Builders,"KOTSIMUL SAND MINE, MAA TARA BUILDERS",WEST BENGAL,Non-Coal,B1,Proposal Accepted and Referred to SEAC,"Diesel, Lubricants, Transportation Fuel",2026,Category: B1 Sector: Non-Coal Mining Date of Submission: 15/01/2026,"Kotsimul Sand Mine,Vill/Mouza-Kotsimul,J.L No-208,Plot No-1349(P),P.S-Madhabdihi,Block -Raina-II,Dist-Purba Bardhaman",Regional Manager - Kolkata,+91-9547535867,kolkata.retrm@hpcl.in,"2ND FLOOR, No-6, Church Lane, Bbd Bag, Kolkata-700001, West Bengal",Regional Manager,0.0
414,Tier 2 - High Priority,55.0,False,90,40.0,0.3,0.1999999999999999,0.6,1.0,Uttar Pradesh,SIA/UP/INFRA2/565215/2026,"Proposed Shifting and Establishing Common Bio-Medical Waste Management Facility in MG Road Industrial Area, Hapur,Uttar Pradesh by M/s Environ Waste Connections LLP.",ENVIRON WASTE CONNECTIONS LLP,UTTAR PRADESH,INFRA-2,B1,Under Examination,"Diesel, Bitumen, Lubricants, Generator Fuel",2026,Category: B1 Sector: INFRA-2 Date of Submission: 15/01/2026,"The project is having an area of approx. 3511.14 sq. m. The components in the project will have Dry Scrubbing Technology based Incinerator of capacity 300 Kg/Hr, No stand by Incinerator. PP have done an MOU with two nearby CBWTFs “as and when required”, two autoclaves having capacity of 250 Kg/hr each, shredder having capacity of 2x250 kg/hr each. The project will cater health care establishment from the district of G.B. Nagar (Noida, Greater Noida), Bulandshar, Baghpat, Merrut,Ghaziabad, Sahara",Retail Regional Manager - Lucknow,0522-2309581,lucknow.retrm@hpcl.in,"Plot No. 1, Nehru Enclave, Gomti Nagar, Lucknow, Uttar Pradesh - 226010",Retail Regional Manager,0.0
415,Tier 3 - Monitor,54.9,False,85,42.0,0.3,0.4,0.4,1.0,Madhya Pradesh,SIA/MP/MIN/559125/2026,"SURESH KUMAR SARAOGI, BHOJPURA STONE QUARRY 1.0 HA",SURESH SARAOGI,MADHYA PRADESH,Non-Coal,B1,EDS raised,"Diesel, Lubricants, Transportation Fuel",2026,Category: B1 Sector: Non-Coal Mining Date of Submission: 21/01/2026,"Bhojpura Stone Quarry mine is located at Khasra No.-4, Village –Bhojpura, Tehsil Orchha, Distt. Niwari (M.P.). The lease has been sanctioned in F/o Suresh Kumar Saraogi. The total lease area of the mine is 1.0 ha. DEIAA has granted EC in vide letter no. 229 dated 10.04.2018 in favor of Suresh kumar Saraogi. The capacity of quarry is for mining of Stone – 9102 cum /year",Retail Regional Manager - Bhopal,0755-4274021,bhop.retrm@hpcl.in,"Gautam Nagar P.O. Govindpura, Bhopal, Madhya Pradesh - 462023",Retail Regional Manager,0.0
416,Tier 3 - Monitor,54.9,False,85,42.0,0.3,0.4,0.4,1.0,Madhya Pradesh,SIA/MP/MIN/559042/2026,"SURESH KUMAR SARAOGI, BHOJPURA STONE QUARRY - 4.0",SURESH SARAOGI,MADHYA PRADESH,Non-Coal,B1,EDS raised,"Diesel, Lubricants, Transportation Fuel",2026,Category: B1 Sector: Non-Coal Mining Date of Submission: 21/01/2026,"Bhojpura Stone Quarry mine is located at Khasra No.-4, Village –Bhojpura, Tehsil Orchha, Distt. Niwari (M.P.). The lease has been sanctioned in F/o Suresh Kumar Saraogi. The total lease area of the mine is 4.0 ha. DEIAA has granted EC in vide letter no. 221 dated 10.04.2018 in favor of Suresh kumar Saraogi. The capacity of quarry is for mining of Stone – 68000 cum /year",Retail Regional Manager - Bhopal,0755-4274021,bhop.retrm@hpcl.in,"Gautam Nagar P.O. Govindpura, Bhopal, Madhya Pradesh - 462023",Retail Regional Manager,0.0
417,Tier 3 - Monitor,54.9,False,85,42.0,0.3,0.4666666666666667,0.4,0.8,Uttar Pradesh,SIA/UP/MIN/564984/2026,"""Ordinary Soil Mining Project"" at Gata No.- 230मि, 312, 270, Village- Shahpur Dasar, Tehsil & District- Sambhal of State- Uttar Pradesh, Area- 1.361 ha by Shri Rajveer Singh",RAJVEER SINGH,UTTAR PRADESH,Non-Coal,B2,Under Verification,"Diesel, Lubricants, Transportation Fuel",2026,Category: B2 Sector: Non-Coal Mining Date of Submission: 23/01/2026,"Ordinary Soil Mining is proposed for Mining of Soil at Gata No.- 230मि, 312, 270 Village- Shahpur Dasar, Tehsil & District- Sambhal of State- Uttar Pradesh over an area of 1.361 ha., being proposed by Shri Rajveer Singh S/o Shri Nanhe Singh. The project proponent is intended to do the maximum production of 27,492 Cubic Meter for 3 Months of Mining Plan Period. The mining plan has been approved by Office of District Magistrate, Sambhal (Bahjoi) (Mining Department) having document No.- 797(2)/खनिज",Retail Regional Manager - Lucknow,0522-2309581,lucknow.retrm@hpcl.in,"Plot No. 1, Nehru Enclave, Gomti Nagar, Lucknow, Uttar Pradesh - 226010",Retail Regional Manager,0.0
418,Tier 3 - Monitor,54.9,False,85,42.0,0.3,0.4,0.4,1.0,Madhya Pradesh,SIA/MP/MIN/562816/2026,TELIYA DHAD STONE & M-SAND QUARRY,NIRMAL KUMAR BHALLAVI,MADHYA PRADESH,Non-Coal,B2,Under Verification,"Diesel, Lubricants, Transportation Fuel",2026,Category: B2 Sector: Non-Coal Mining Date of Submission: 21/01/2026,"This is a crusher stone quarry. It comes under the B1 Category. We are using an open-cast semi-mechanised mining method of production, and its minable reserve production is 2,40,500 Cub Meters and annual production is 20,000 Cub Meters",Retail Regional Manager - Bhopal,0755-4274021,bhop.retrm@hpcl.in,"Gautam Nagar P.O. Govindpura, Bhopal, Madhya Pradesh - 462023",Retail Regional Manager,0.0
419,Tier 3 - Monitor,54.8,False,73,47.0,0.7,0.0333333333333333,0.4,1.0,West Bengal,IA/WB/IND1/565009/2026,"Expansion cum modification of existing Steel Plant by modification of existing Sinter Plant from (1X60 M2 + 2X26 M2) to (1X70 M2 + 2X30 M2), upgradation of existing 2X300 M3 MBF to 2X365 M3 MBF, upgradation of existing EAFs from (1X4 MVA + 4X3 MVA) to (5X4 MVA), expansion of existing DIP Plant from 6,04,800 TPA to 10,00,000 TPA and Installation of new units 1.8 MTPA Iron ore Beneficiation Plant, 1.2 MTPA Pellet Plant, 2,00,000 TPA PCI Plant, 1,11,680 TPA O2 Plant and 2,00,000 TPA Rolling Mill",JAI BALAJI INDUSTRIES LTD,WEST BENGAL,Industrial,A,Standard ToR Granted,"Furnace Oil, Diesel, Lubricants",2026,Category: A Sector: Industrial Projects - 1 Date of Submission: 10/01/2026,"Existing Project : Blast Furnaces (1X250 M3 & 1X300 M3) to produce 5,58,250 TPA Hot Metal, 9,08,256 TPA Sinter Plant, 5,04,000 TPA DIP Plant and 33,000 Ferro Alloys Plant (through EAF route). Proposes expansion cum modification of the existing plant through following way : - Modification of existing Sinter Plant from (1X60 M2 + 2 X 26 M2) to (1X70 M2 + 2 X 30 M2) - Upgradation of existing 2X300 M3 MBFs to 2X365 M3 MBFs - Installation of new 2,00,000 TPA PCI Plant - Upgradation of existing EAFs f",Regional Manager - Kolkata,+91-9547535867,kolkata.retrm@hpcl.in,"2ND FLOOR, No-6, Church Lane, Bbd Bag, Kolkata-700001, West Bengal",Regional Manager,0.0
420,Tier 3 - Monitor,54.7,False,75,46.0,0.7,0.0,0.4,1.0,Madhya Pradesh,SIA/MP/MIN/564239/2026,Pipalyakalan Murrum Stone (Gitti & M Sand) Quarry,RAJPAL RATHORE,MADHYA PRADESH,Non-Coal,B1,Standard ToR Granted,"Diesel, Lubricants, Transportation Fuel",2026,Category: B1 Sector: Non-Coal Mining Date of Submission: 07/01/2026,"It is a expansion project of Murrum, Stone(Gitti & M-Sand) Quarry with a previous production capacity of 7,000 m3/year Murrum to expanded production capacity of 7,000 m3/ Year Stone (Gitti), 11,000 m3/year M-Sand &, 7,000 m3/Year Murrum having a lease area of 2.00 hectare, at Khasra No. 338 (Govt. land) Village - Pipalyakalan, Tehsil-Agar District- Agar Malwa (M.P.)",Retail Regional Manager - Bhopal,0755-4274021,bhop.retrm@hpcl.in,"Gautam Nagar P.O. Govindpura, Bhopal, Madhya Pradesh - 462023",Retail Regional Manager,0.0
421,Tier 3 - Monitor,54.7,False,82,43.0,0.3,0.4333333333333333,0.4,1.0,Maharashtra,SIA/MH/INFRA2/566431/2026,"Proposed construction of New Medical College of 100 Students Capacity & 430 Bedded Hospital at Bramhangaon by The Dean of Government Medical College and Hospital, Parbhani",Government medical college parbhani,MAHARASHTRA,INFRA-2,B2,Under Verification,"Diesel, Bitumen, Lubricants, Generator Fuel",2026,Category: B2 Sector: INFRA-2 Date of Submission: 22/01/2026,Building & Construction Project- Hospital & Medical College,Retail Regional Manager - Mumbai,022-26403955,mum.retrm@hpcl.in,"3/4, Jn. of S.V. Rd and Turner Rd Bandra (West) Mumbai, Maharashtra - 400050",Retail Regional Manager,0.0
422,Tier 3 - Monitor,54.7,False,82,43.0,0.3,0.4333333333333333,0.4,1.0,Maharashtra,SIA/MH/INFRA2/566344/2026,"Prior Environment Clearance for Proposed Residential Cum Commercial Building on Plot Bearing C.T.S. No. – 1914/7, Kopari, Thane by M/s. Mextech Realty Private Limited",MEXTECH REALTY PRIVATE LIMITED,MAHARASHTRA,INFRA-2,B2,Under Verification,"Diesel, Bitumen, Lubricants, Generator Fuel",2026,Category: B2 Sector: INFRA-2 Date of Submission: 22/01/2026,"Proposed Project is a residential cum commercial development comprising of 1 building having 2 wings (i.e Wing A & B). Total Built-up Area – 48,836.507 sq. m.",Retail Regional Manager - Mumbai,022-26403955,mum.retrm@hpcl.in,"3/4, Jn. of S.V. Rd and Turner Rd Bandra (West) Mumbai, Maharashtra - 400050",Retail Regional Manager,0.0
423,Tier 3 - Monitor,54.7,False,82,43.0,0.3,0.4333333333333333,0.4,1.0,Uttar Pradesh,SIA/UP/INFRA2/566121/2026,"Proposed Affordable Group Housing At Arzi No.-59,60,61,62,63,64 Mauza-Ashapur, and Arzi No.-152,153 Mauza-TulsiPatti, Pargana Adhagaowna, Pindra, Varanasi, U.P",pRIME BUILDERS & DEVELOPERS,UTTAR PRADESH,INFRA-2,B2,Under Verification,"Diesel, Bitumen, Lubricants, Generator Fuel",2026,Category: B2 Sector: INFRA-2 Date of Submission: 22/01/2026,"Proposed Affordable Group Housing At Arzi No.-59,60,61,62,63,64 Mauza-Ashapur, and Arzi No.-152,153 Mauza-TulsiPatti, Pargana Adhagaowna, Pindra, Varanasi, U.P",Retail Regional Manager - Lucknow,0522-2309581,lucknow.retrm@hpcl.in,"Plot No. 1, Nehru Enclave, Gomti Nagar, Lucknow, Uttar Pradesh - 226010",Retail Regional Manager,0.0
424,Tier 3 - Monitor,54.7,False,82,43.0,0.3,0.4333333333333333,0.4,1.0,Maharashtra,SIA/MH/INFRA2/566457/2026,Proposed Residential and Commercial Project by M/s. Maravillosa Residency LLP,Maravillosa residency llp,MAHARASHTRA,INFRA-2,B2,Under Verification,"Diesel, Bitumen, Lubricants, Generator Fuel",2026,Category: B2 Sector: INFRA-2 Date of Submission: 22/01/2026,"Project is fresh Residential & Commercial proposed at S. No. 33/1/2/4 + 33/1/1 + 18/10/1(P), at Village- Vadgaon (BK), Taluka- Haveli, Dist-Pune, Maharashtra",Retail Regional Manager - Mumbai,022-26403955,mum.retrm@hpcl.in,"3/4, Jn. of S.V. Rd and Turner Rd Bandra (West) Mumbai, Maharashtra - 400050",Retail Regional Manager,0.0
425,Tier 3 - Monitor,54.7,False,82,43.0,0.3,0.4333333333333333,0.4,1.0,Haryana,SIA/HR/INFRA2/566308/2026,"Proposed Group housing colony over an area measuring 4.75 acres in the revenue estates of Village- khaika, Sector-4, Sohna, District-Gurugram AAR Housing Private Limited",AAR HOUSING PRIVATE LIMITED,HARYANA,INFRA-2,B2,Under Verification,"Diesel, Bitumen, Lubricants, Generator Fuel",2026,Category: B2 Sector: INFRA-2 Date of Submission: 22/01/2026,Proposed Group housing colony over an area measuring 4.75 acres in the revenue estates of Village,Retail Regional Manager - Panipat,0180-2681328,panipat.retrm@hpcl.in,"E-22, Court Road, Industrial Area, Panipat - 132101",Retail Regional Manager,0.0
426,Tier 3 - Monitor,54.5,False,93,38.0,0.3,0.2666666666666667,0.4,1.0,Madhya Pradesh,IA/MP/MIN/563903/2026,"Golighat and Vanadium Block for Graphite and Vanadium Deposit in Aprapan Behera Village, Tehsil & District Betul, Madhya Pradesh : Shanti GD Ispat & Power Limited",SHANTI G.D. ISPAT AND POWER PVT. LTD.,MADHYA PRADESH,Non-Coal,B1,Under Examination,"Diesel, Lubricants, Transportation Fuel",2026,Category: B1 Sector: Non-Coal Mining Date of Submission: 17/01/2026,"The Golighat Graphite & Vanadium Mining Project, proposed by M/s. Shanti G D Ispat and Power Private Limited, is a Category ‘A’ opencast mining project located in Betul District, Madhya Pradesh, over a mining lease area of 82.00 Ha. The project involves mechanized opencast mining with benching and controlled deep-hole blasting, strictly in accordance with the Approved Mining Plan and DGMS guidelines. The project is proposed with a maximum ROM production capacity of 100,258.99 tonnes per annum, w",Retail Regional Manager - Bhopal,0755-4274021,bhop.retrm@hpcl.in,"Gautam Nagar P.O. Govindpura, Bhopal, Madhya Pradesh - 462023",Retail Regional Manager,0.0
427,Tier 3 - Monitor,54.4,False,95,37.0,0.3,0.1666666666666666,0.6,0.8,Madhya Pradesh,SIA/MP/MIN/564357/2026,"PURENAKARAN CRUSHER STONE, M-SAND & MURRUM QUARRY LEASE",KUSHAL PATERIYA,MADHYA PRADESH,Non-Coal,B1,Under Verification,"Diesel, Lubricants, Transportation Fuel",2026,Category: B1 Sector: Non-Coal Mining Date of Submission: 14/01/2026,"Purena Karan Crusher Stone, M Sand Quarry Deposit (LOI Vide letter no. Kr./840/Khanij/2024, Sagar Dated 11/07/2024) is situated at Khasra no- 4, Village- Purenakaran, Tehsil- Deori, District- Sagar, and State- Madhya Pradesh",Retail Regional Manager - Bhopal,0755-4274021,bhop.retrm@hpcl.in,"Gautam Nagar P.O. Govindpura, Bhopal, Madhya Pradesh - 462023",Retail Regional Manager,0.0
428,Tier 3 - Monitor,54.3,False,90,39.0,0.3,0.1666666666666666,0.6,1.0,Haryana,SIA/HR/INFRA2/565516/2026,Proposed Group Housing Project at Village - Harsaru Tehsil- Harsaru Sector-88A District-Gurugram by M/s Experion Developers Pvt Ltd,EXPERION DEVELOPERS PRIVATE LIMITED,HARYANA,INFRA-2,B1,Under Examination,"Diesel, Bitumen, Lubricants, Generator Fuel",2026,Category: B1 Sector: INFRA-2 Date of Submission: 14/01/2026,Proposed Group Housing Project at Village - Harsaru Tehsil- Harsaru Sector-88A District-Gurugram by M/s Experion Developers Pvt Ltd,Retail Regional Manager - Panipat,0180-2681328,panipat.retrm@hpcl.in,"E-22, Court Road, Industrial Area, Panipat - 132101",Retail Regional Manager,0.0
429,Tier 3 - Monitor,54.3,False,90,39.0,0.3,0.1666666666666666,0.6,1.0,Haryana,SIA/HR/INFRA2/565518/2026,"Mix Land Use Colony under TOD Policy Project at Village- Fazilpur Jharsa, Sector-71, Gurugram -Manesar Urban Complex, Haryana by M/s Signatureglobal (India) Limited",SIGNATUREGLOBAL INDIA LIMITED,HARYANA,INFRA-2,B1,Under Examination,"Diesel, Bitumen, Lubricants, Generator Fuel",2026,Category: B1 Sector: INFRA-2 Date of Submission: 14/01/2026,project facilities include:  Residential Dwelling Units  Commercial facilities,Retail Regional Manager - Panipat,0180-2681328,panipat.retrm@hpcl.in,"E-22, Court Road, Industrial Area, Panipat - 132101",Retail Regional Manager,0.0
430,Tier 3 - Monitor,54.3,False,90,39.0,0.3,0.3,0.4,1.0,West Bengal,SIA/WB/MIN/565618/2026,Rerapal Sand Mine (MSB-43),SANJIB MANDAL,WEST BENGAL,Non-Coal,B1,Proposal Accepted and Referred to SEAC,"Diesel, Lubricants, Transportation Fuel",2026,Category: B1 Sector: Non-Coal Mining Date of Submission: 18/01/2026,"Rerapal Sand Mine (MSB-43) is situated at J. L. No. – 132, Plot No. 700(P), Mouza – Rerapal, Village – Rerapal, Police Station – Medinipur, District – Paschim Medinipur, State - West Bengal and it lies on Kangsabati River comprising an area of 4.20 Hectare (10.38 Acres). The block is having replenishable geological resource of riverbed materials consists of mainly Sand in a tune of around 5,81,263.20 cum in 5 years considering replenishment rate of 90.33%. Barring the safety zone and blocked res",Regional Manager - Kolkata,+91-9547535867,kolkata.retrm@hpcl.in,"2ND FLOOR, No-6, Church Lane, Bbd Bag, Kolkata-700001, West Bengal",Regional Manager,0.0
431,Tier 3 - Monitor,54.3,False,90,39.0,0.3,0.1666666666666666,0.6,1.0,Haryana,SIA/HR/INFRA2/565533/2026,"RESIDENTIAL COLONY PROJECT UNDER NILP POLICY At VILLAGE- FAZILPUR JHARSA, SECTOR-71, DISTRICT-GURUGRAM, HARYANA by M/s SIGNATUREGLOBAL (INDIA) LTD.",SIGNATUREGLOBAL INDIA LIMITED,HARYANA,INFRA-2,B1,Under Examination,"Diesel, Bitumen, Lubricants, Generator Fuel",2026,Category: B1 Sector: INFRA-2 Date of Submission: 14/01/2026,"RESIDENTIAL COLONY PROJECT UNDER NILP POLICY At VILLAGE- FAZILPUR JHARSA, SECTOR-71, DISTRICT-GURUGRAM, HARYANA by M/s SIGNATUREGLOBAL (INDIA) LTD. The residential colony project will be developed in an area of 50,181.014 Sq.m. (12.40 Acres) with total built-up area of 2,47,702.73 Sq.m. The project facilities include: Residential (812 DUs) [5 Towers] Commercial Club",Retail Regional Manager - Panipat,0180-2681328,panipat.retrm@hpcl.in,"E-22, Court Road, Industrial Area, Panipat - 132101",Retail Regional Manager,0.0
432,Tier 3 - Monitor,54.2,False,85,41.0,0.3,0.3666666666666667,0.4,1.0,Uttar Pradesh,SIA/UP/MIN/566227/2026,"“Ordinary Soil Mining Project” at Gata 70, 113, 116, 117 & 118 in Village-Makanpur, Tehsil- Bilari & Distt- Moradabad, Uttar Pradesh. (Lease Area: 2.1734 Ha.) Project Proponent - Shri Mohit Kumar",MOHIT KUMAR,UTTAR PRADESH,Non-Coal,B2,Under Verification,"Diesel, Lubricants, Transportation Fuel",2026,Category: B2 Sector: Non-Coal Mining Date of Submission: 20/01/2026,"“Ordinary Soil Mining Project” at Gata 70, 113, 116, 117 & 118 in Village-Makanpur, Tehsil- Bilari & Distt- Moradabad, Uttar Pradesh. (Lease Area: 2.1734 Ha.)",Retail Regional Manager - Lucknow,0522-2309581,lucknow.retrm@hpcl.in,"Plot No. 1, Nehru Enclave, Gomti Nagar, Lucknow, Uttar Pradesh - 226010",Retail Regional Manager,0.0
433,Tier 3 - Monitor,54.2,False,85,41.0,0.3,0.4333333333333333,0.4,0.8,Uttar Pradesh,SIA/UP/MIN/566441/2026,"Ordinary Soil Mining Project at Gata No. 585, 771, Village - Gorakala, Tehsil Kalpi, District Jalaun, Uttar Pradesh (Area: 1.266 ha, Proposed Capacity: 21,080 cum)",AVDHESH SINGH RATHORE,UTTAR PRADESH,Non-Coal,B2,Under Verification,"Diesel, Lubricants, Transportation Fuel",2026,Category: B2 Sector: Non-Coal Mining Date of Submission: 22/01/2026,"As per EIA Notification, 2006 (as amended) Category: B2 – Minor Mineral (Ordinary Soil) Mining Project: Ordinary Soil Mining Project at Location: Gata No. 585, 771, Village - Gorakala, Tehsil Kalpi, District Jalaun, Uttar Pradesh (Area: 1.266 ha, Proposed Capacity: 21,080 cum) Proponent: AvdheshRathore S/o Ram Singh Rathore",Retail Regional Manager - Lucknow,0522-2309581,lucknow.retrm@hpcl.in,"Plot No. 1, Nehru Enclave, Gomti Nagar, Lucknow, Uttar Pradesh - 226010",Retail Regional Manager,0.0
434,Tier 3 - Monitor,54.2,False,78,44.0,0.7,0.0,0.4,0.8,West Bengal,SIA/WB/IND1/564937/2026,"Environmental Clearance for Expansion of production capacity from 1,08,000 TPA MS Pipe (ERW pipe) to 1,78,800 TPA CRM (Cold rolling mill)/Galvanized Pipe/ERW Pipe by Installation of Pickling and Galvanizing Facilities by M/s. Supershakti Energy Private Limited at Jamuria Industrial Estate, PO-Mondalpur, PS-Jamuria, Dist-Paschim Bardhaman, Pin-713336, State- West Bengal",SUPERSHAKTI ENERGY PRIVATE LIMITED,WEST BENGAL,Industrial,B2,Under Verification,"Furnace Oil, Diesel, Lubricants",2026,Category: B2 Sector: Industrial Projects - 1 Date of Submission: 09/01/2026,"It is an expansion of production capacity from 1,08,000 TPA MS Pipe (ERW pipe) to 1, 78,800 TPA CRM (cold rolling mill)/Galvanized Pipe/ERW Pipe by Installation of Pickling and Galvanizing Facilities. The unit is located at Jamuria Industrial Estate, PO-Mondalpur, PS-Jamuria, Dist-Paschim Bardhaman, Pin-713336, State- West Bengal.",Regional Manager - Kolkata,+91-9547535867,kolkata.retrm@hpcl.in,"2ND FLOOR, No-6, Church Lane, Bbd Bag, Kolkata-700001, West Bengal",Regional Manager,0.0
435,Tier 3 - Monitor,54.2,False,78,44.0,0.3,0.4666666666666667,0.4,1.0,Madhya Pradesh,SIA/MP/IND3/566089/2026,"Single Super Phosphate Project (1,32,000 TPA)",U M SHEETLA AGRO INDUSTRIES PRIVATE LIMITED,MADHYA PRADESH,Industrial,B1,EDS raised,"Furnace Oil, Diesel, Lubricants",2026,Category: B1 Sector: Industrial Projects - 3 Date of Submission: 23/01/2026,"The project proposal is for establishing and operating a Single Super Phosphate (SSP) Plant for production of 1,32,000 TPA Granulated Single Super Phosphate (GSSP). The main raw materials are blended Rock Phosphate and Sulphuric Acid.",Retail Regional Manager - Bhopal,0755-4274021,bhop.retrm@hpcl.in,"Gautam Nagar P.O. Govindpura, Bhopal, Madhya Pradesh - 462023",Retail Regional Manager,0.0
436,Tier 3 - Monitor,54.2,False,85,41.0,0.3,0.3666666666666667,0.4,1.0,West Bengal,SIA/WB/MIN/563926/2026,SAND BLOCK – GUMTA SAND MINE – {SAND BLOCK CODE - (Bir/Mayureswar - II/Gumta/085/2016)},PAWAN ARORA,WEST BENGAL,Non-Coal,B2,Under Verification,"Diesel, Lubricants, Transportation Fuel",2026,Category: B2 Sector: Non-Coal Mining Date of Submission: 20/01/2026,"SAND BLOCK – GUMTA SAND MINE – (SAND BLOCK CODE - Bir/Mayureswar - II/Gumta/085/2016) is situated at J. L. No. 077, Plot No. 905(P), Mouza – Gumta, Village – Gumta, Police Station – Mayureswar, District – Birbhum, State - West Bengal and it lies on Mayurakshi River comprising an area of 2.57 Hectare (6.35 Acres). The block is having replenishable geological resource of riverbed material consists of mainly Sand in a tune of around 3,06,333.72 cum in 5 years considering replenishment rate of 74.33",Regional Manager - Kolkata,+91-9547535867,kolkata.retrm@hpcl.in,"2ND FLOOR, No-6, Church Lane, Bbd Bag, Kolkata-700001, West Bengal",Regional Manager,0.0
