ID,Priority_Tier,Final_Score,High_Urgency_Flag,Lead_Score,Enhanced_Score,Intent_Signal,Freshness_Score,Size_Score,Proximity_Score,State,Proposal No.,Project Name,Project Proponent,Location,Sector,Category,Proposal Status,Recommended_Products,Submission_Year,Other Details,Project_Description,Officer_Name,Officer_Phone,Officer_Email,Officer_Address,Officer_Role,Officer_Distance_KM
653,Tier 3 - Monitor,45.6,False,75,33.0,0.3,0.0999999999999999,0.4,1.0,Madhya Pradesh,SIA/MP/MIN/565295/2026,Amiliya Sand Quarry_11.00 ha,PREM LAL DWIVEDI,MADHYA PRADESH,Non-Coal,B1,Standard ToR Granted,"Diesel, Lubricants, Transportation Fuel",2026,Category: B1 Sector: Non-Coal Mining Date of Submission: 12/01/2026,"Sand Quarry on Son River, Located at Khasra No. 1/601, Amiliya Village, Manpur Tehsil, Umaria District, Madhya Pradesh. Total lease area is 11.00 ha.",Retail Regional Manager - Bhopal,0755-4274021,bhop.retrm@hpcl.in,"Gautam Nagar P.O. Govindpura, Bhopal, Madhya Pradesh - 462023",Retail Regional Manager,0.0
654,Tier 3 - Monitor,45.6,False,75,33.0,0.3,0.0999999999999999,0.4,1.0,Madhya Pradesh,SIA/MP/MIN/565229/2026,Parasi Sand Quarry_10.0Ha,PREM LAL DWIVEDI,MADHYA PRADESH,Non-Coal,B1,Standard ToR Granted,"Diesel, Lubricants, Transportation Fuel",2026,Category: B1 Sector: Non-Coal Mining Date of Submission: 12/01/2026,"Sand Quarry on Son River, Located at Khasra No. 46/407, Parasi Village, Manpur Tehsil, Umaria District, Madhya Pradesh. Total lease area is 10.00 ha.",Retail Regional Manager - Bhopal,0755-4274021,bhop.retrm@hpcl.in,"Gautam Nagar P.O. Govindpura, Bhopal, Madhya Pradesh - 462023",Retail Regional Manager,0.0
655,Tier 3 - Monitor,45.6,False,75,33.0,0.3,0.1666666666666666,0.4,0.8,Madhya Pradesh,SIA/MP/MIN/565014/2026,"HATHKHOH STONE (GITTI), BOULDER, MURRUM & M-SAND QUARRY",Rajendra sahu (HUF),MADHYA PRADESH,Non-Coal,B1,Standard ToR Granted,"Diesel, Lubricants, Transportation Fuel",2026,Category: B1 Sector: Non-Coal Mining Date of Submission: 14/01/2026,"This is a Stone (Gitti), Boulder, Murrum & M-sand quarry. It comes under the B1 Category. We are using an open cast semi-mechanised mining method, and annual production is 83,225 (Max) M3/Year (Boulder-5125, Stone (Gitti)-40,000, Murrum-28100 & M-Sand-10,000), Khasra no. -212 (Part), Area - 4.00 Ha, Village- Hath Khoh, Tehsil– Deori , District - Sagar (M.P.).",Retail Regional Manager - Bhopal,0755-4274021,bhop.retrm@hpcl.in,"Gautam Nagar P.O. Govindpura, Bhopal, Madhya Pradesh - 462023",Retail Regional Manager,0.0
656,Tier 3 - Monitor,45.6,False,82,30.0,0.3,0.0,0.4,1.0,Maharashtra,SIA/MH/INFRA2/564697/2026,"Environment Clearance for proposed slum rehabilitation scheme under reg. 33(10) on plot bearing CTS No. 128/A/7, 128/A/8A(Pt.) &128A/9 of Village Kandivali, Taluka Borivali Bunder Pakhadi Road, Kandivali (West), Mumbai-67, For Shiv Samrat SRA CHS (Prop.), Jijasai SRA CHS (Prop.) by M/S. Conwood Agencies Pvt. Ltd.",Conwood agencies private limited,MAHARASHTRA,INFRA-2,B2,Under Verification,"Diesel, Bitumen, Lubricants, Generator Fuel",2026,Category: B2 Sector: INFRA-2 Date of Submission: 09/01/2026,Proposed project consists of 2 residential buildings and 1 parking building. Configuration of the same is as follows: Sale Building No 1: 3 Basement (Parking) + Ground (part parking) + 1st to 8th Podium for parking + 9th Deck Floor (amenities) + Service Floor + 1st to 38th Upper residential Floors (154.40 m) Rehab Building No 1: Basement (for services) + Ground (Shops) + 1st to 38th Upper residential Floors (113.55 m) Mechanical Parking Tower - up to 56.15 m,Retail Regional Manager - Mumbai,022-26403955,mum.retrm@hpcl.in,"3/4, Jn. of S.V. Rd and Turner Rd Bandra (West) Mumbai, Maharashtra - 400050",Retail Regional Manager,0.0
657,Tier 3 - Monitor,45.6,False,75,33.0,0.3,0.0999999999999999,0.4,1.0,Madhya Pradesh,SIA/MP/MIN/564365/2026,Sindurkiya Stone & M-Sand Quarry (2.00 Ha),MAHENDRA SOLANKI,MADHYA PRADESH,Non-Coal,B1,Standard ToR Granted,"Diesel, Lubricants, Transportation Fuel",2026,Category: B1 Sector: Non-Coal Mining Date of Submission: 12/01/2026,"The Sindurkiya Stone & M-Sand Quarry (LOI letter no 779 / Khanij/2025-26, Ratlam dated 14-07-2025) is situated at Khasra no. 348/1, Village - Sindurkiya, Tehsil - Jaora, District - Ratlam, Madhya Pradesh over an area of 2.000 Ha. The concerned Sindurkiya Stone & M-Sand Quarry Mining Project is proposed by Shri Mahendra Singh Solanki S/O Shri Manohar Singh Solanki. The project proponent is intended to the maximum 96,432 Cubic Meter Per Annum (Stone & M-sand). The estimated project cost is Rs.70 L",Retail Regional Manager - Bhopal,0755-4274021,bhop.retrm@hpcl.in,"Gautam Nagar P.O. Govindpura, Bhopal, Madhya Pradesh - 462023",Retail Regional Manager,0.0
658,Tier 3 - Monitor,45.6,False,82,30.0,0.3,0.0,0.4,1.0,Uttar Pradesh,SIA/UP/INFRA2/564002/2026,"Environmental Clearance for the Proposed Development of Charbagh Bus Terminal cum commercial complexes at Charbagh, Lucknow, Uttar Pradesh by Uttar Pradesh State Road Transport Corporation (UPSRTC) and D. G. S. Township Private Limited",Surajdev D shukla,UTTAR PRADESH,INFRA-2,B2,Under Verification,"Diesel, Bitumen, Lubricants, Generator Fuel",2026,Category: B2 Sector: INFRA-2 Date of Submission: 02/01/2026,Development of Charbagh Bus Terminal cum commercial complexes,Retail Regional Manager - Lucknow,0522-2309581,lucknow.retrm@hpcl.in,"Plot No. 1, Nehru Enclave, Gomti Nagar, Lucknow, Uttar Pradesh - 226010",Retail Regional Manager,0.0
659,Tier 3 - Monitor,45.6,False,82,30.0,0.3,0.0,0.4,1.0,Madhya Pradesh,SIA/MP/INFRA2/562490/2026,DATT SOLITARE DEVELOPER DATT REAL INFRA PVT. LTD. PHASE - 1 & 3,VISHAL DATT,MADHYA PRADESH,INFRA-2,B2,Under Verification,"Diesel, Bitumen, Lubricants, Generator Fuel",2026,Category: B2 Sector: INFRA-2 Date of Submission: 03/01/2026,Building project,Retail Regional Manager - Bhopal,0755-4274021,bhop.retrm@hpcl.in,"Gautam Nagar P.O. Govindpura, Bhopal, Madhya Pradesh - 462023",Retail Regional Manager,0.0
660,Tier 3 - Monitor,45.6,False,75,33.0,0.3,0.0999999999999999,0.4,1.0,Madhya Pradesh,SIA/MP/MIN/565288/2026,Amiliya Sand Quarry_9.00 ha,PREM LAL DWIVEDI,MADHYA PRADESH,Non-Coal,B1,Standard ToR Granted,"Diesel, Lubricants, Transportation Fuel",2026,Category: B1 Sector: Non-Coal Mining Date of Submission: 12/01/2026,"Sand Quarry on Son River, Located at Khasra No. 1/601, Amiliya Village, Manpur Tehsil, Umaria District, Madhya Pradesh.. Total lease area is 9.00 ha.",Retail Regional Manager - Bhopal,0755-4274021,bhop.retrm@hpcl.in,"Gautam Nagar P.O. Govindpura, Bhopal, Madhya Pradesh - 462023",Retail Regional Manager,0.0
661,Tier 3 - Monitor,45.6,False,75,33.0,0.3,0.1666666666666666,0.4,0.8,Madhya Pradesh,SIA/MP/MIN/565072/2026,HATH KHOH STONE (GITTI) & M-SAND QUARRY,RASHMI Patel,MADHYA PRADESH,Non-Coal,B1,Standard ToR Granted,"Diesel, Lubricants, Transportation Fuel",2026,Category: B1 Sector: Non-Coal Mining Date of Submission: 14/01/2026,"This is a Hath Khoh Stone (Gitti) & M-Sand Quarry. It comes under the B1 category. We are using an open-cast semi-mechanised mining method with an annual production of 1,00,004 Cub meters/Year (Stone (Gitti) -75,003 Cub Meter/Year & M-Sand-25,001 Cub Meter/Year), Khasra no - 212, Area - 4.00 Ha, Village- Hath Khoh, Tehsil – Deori, District - Sagar (M.P.)",Retail Regional Manager - Bhopal,0755-4274021,bhop.retrm@hpcl.in,"Gautam Nagar P.O. Govindpura, Bhopal, Madhya Pradesh - 462023",Retail Regional Manager,0.0
662,Tier 3 - Monitor,45.6,False,82,30.0,0.3,0.0,0.4,1.0,Haryana,SIA/HR/INFRA2/546549/2026,"AGRO BASED WAREHOUSE IN THE REVENUE ESTATE OF VILLAGE KHEWRA & DIPALPUR, DISTRICT: SONIPAT BY M/S BHUPENDER JAIN & SONS HUF",BHUPENDER JAIN & SONS HUF,HARYANA,INFRA-2,B2,Under Verification,"Diesel, Bitumen, Lubricants, Generator Fuel",2026,Category: B2 Sector: INFRA-2 Date of Submission: 02/01/2026,"M/S Bhupender Jain & Sons HUF has proposed the setting up of the Warehouse (Agro based) project located at Khasra no. 15//9/2, 10, 11, 12/1, 19/2, 20, 21, 22, 16//18, 19, 22/1, 22/2, 23, 24/1, 18//2/1, 2/2, 3, 4, 6, 7/1 in the revenue estate of village Khewra, Tehsil Rai, District Sonipat & khasra no. 60//11/2, 61//9/2, 10/1, 11/2, 12, 16, 17, 18, 19, 20/1, 20/2, 21/2, 22 in the revenue estate of village Dipalpur, Tehsil & District Sonipat. CLU has been obtained vide Memo No. CLU/ST-3869A/CTP/88",Retail Regional Manager - Panipat,0180-2681328,panipat.retrm@hpcl.in,"E-22, Court Road, Industrial Area, Panipat - 132101",Retail Regional Manager,0.0
663,Tier 3 - Monitor,45.4,False,65,37.0,0.3,0.2333333333333332,0.4,1.0,Maharashtra,SIA/MH/MIN/565836/2026,"Transfer of Environmental Clearance Kavlewada 3 Sand Ghat over an extent of 2.67 ha. At Bawanthadi River Bed Adjoining Gut No. 237, 238, 239, 240, 241, Village Kavlewada, Tehsil Tumsar, District Bhandara, Maharashtra. by M/s. Anoj kumar Agarwala",M/S ANOJ KUMAR AGARWALA,MAHARASHTRA,Non-Coal,B2,EC Granted,"Diesel, Lubricants, Transportation Fuel",2026,Category: B2 Sector: Non-Coal Mining Date of Submission: 16/01/2026,"Transfer of Environmental Clearance Kavlewada 3 Sand Ghat over an extent of 2.67 ha. At Bawanthadi River Bed Adjoining Gut No. 237, 238, 239, 240, 241, Village Kavlewada, Tehsil Tumsar, District Bhandara, Maharashtra. by M/s. Anoj kumar Agarwala",Retail Regional Manager - Mumbai,022-26403955,mum.retrm@hpcl.in,"3/4, Jn. of S.V. Rd and Turner Rd Bandra (West) Mumbai, Maharashtra - 400050",Retail Regional Manager,0.0
664,Tier 3 - Monitor,45.4,False,72,34.0,0.3,0.0,0.6,1.0,Maharashtra,SIA/MH/INFRA2/563032/2026,"Proposed Residential & Commercial Construction Project at Shaligram Realty LLP, Survey No 148, Alandi- Vishrantwadi Road, Tapkir Chowk, Wadmukhwadi-412105. By M/s. Shaligram Realty LLP",M/S. SHALIGRAM REALTY LLP,MAHARASHTRA,INFRA-2,B1,Pending at MS SEIAA,"Diesel, Bitumen, Lubricants, Generator Fuel",2026,Category: B1 Sector: INFRA-2 Date of Submission: 02/01/2026,"Proposed Residential & Commercial Construction Project at Shaligram Realty LLP, Survey No 148, Alandi- Vishrantwadi Road, Tapkir Chowk, Wadmukhwadi-412105. By M/s. Shaligram Realty LLP",Retail Regional Manager - Mumbai,022-26403955,mum.retrm@hpcl.in,"3/4, Jn. of S.V. Rd and Turner Rd Bandra (West) Mumbai, Maharashtra - 400050",Retail Regional Manager,0.0
665,Tier 3 - Monitor,45.4,False,72,34.0,0.3,0.0,0.6,1.0,Madhya Pradesh,SIA/MP/INFRA2/564238/2026,Development of Common Bio-Medical Waste Treatment & Recycling Facility,SHUDDHAVITA ECO SOLUTIONS PRIVATE LIMITED,MADHYA PRADESH,INFRA-2,B1,Standard ToR Granted,"Diesel, Bitumen, Lubricants, Generator Fuel",2026,Category: B1 Sector: INFRA-2 Date of Submission: 08/01/2026,"Dvelopment of Common Bio-Medical Waste Treatment & Recycling Facility located at Village Mahu Khasra No. 161/2 Panchayat Badaaamlya, Block Raghogarh, District- Guna, Madhya Pradesh.",Retail Regional Manager - Bhopal,0755-4274021,bhop.retrm@hpcl.in,"Gautam Nagar P.O. Govindpura, Bhopal, Madhya Pradesh - 462023",Retail Regional Manager,0.0
666,Tier 3 - Monitor,45.4,False,72,34.0,0.3,0.1666666666666666,0.4,0.9,Madhya Pradesh,SIA/MP/INFRA2/563441/2026,Construction of Industrial shed for manufacturing of Rotor Blade for Wind Turbine Generators of M/s Suzlon Energy Ltd.,SUZLON ENERGY LIMITED,MADHYA PRADESH,INFRA-2,B2,EDS raised,"Diesel, Bitumen, Lubricants, Generator Fuel",2026,Category: B2 Sector: INFRA-2 Date of Submission: 14/01/2026,"Construction of Industrial shed for manufacturing of Rotor Blade for Wind Turbine Generators at Village – Borali, Tehsil - Badnawar, District - Dhar (MP)",Retail Regional Manager - Bhopal,0755-4274021,bhop.retrm@hpcl.in,"Gautam Nagar P.O. Govindpura, Bhopal, Madhya Pradesh - 462023",Retail Regional Manager,0.0
667,Tier 3 - Monitor,45.4,False,65,37.0,0.3,0.2333333333333332,0.4,1.0,Maharashtra,SIA/MH/MIN/565841/2026,"Transfer of Environmental Clearance Sondya 2 Sand Ghat over an extent of 4.60 ha. At Bawanthadi River Bed Adjoining Gut No. 171, 172, 173, Village Sondya, Tehsil Tumsar, District Bhandara, Maharashtra. by M/s. Anoj kumar Agarwala",M/S ANOJ KUMAR AGARWALA,MAHARASHTRA,Non-Coal,B2,EC Granted,"Diesel, Lubricants, Transportation Fuel",2026,Category: B2 Sector: Non-Coal Mining Date of Submission: 16/01/2026,"Transfer of Environmental Clearance Sondya 2 Sand Ghat over an extent of 4.60 ha. At Bawanthadi River Bed Adjoining Gut No. 171, 172, 173, Village Sondya, Tehsil Tumsar, District Bhandara, Maharashtra. by M/s. Anoj kumar Agarwala",Retail Regional Manager - Mumbai,022-26403955,mum.retrm@hpcl.in,"3/4, Jn. of S.V. Rd and Turner Rd Bandra (West) Mumbai, Maharashtra - 400050",Retail Regional Manager,0.0
668,Tier 3 - Monitor,45.4,False,72,34.0,0.3,0.0,0.6,1.0,Maharashtra,SIA/MH/INFRA2/557070/2026,"Application for Amendment/Expansion in EC & CRZ Clearance for Residential Cum Commercial Project “Bhakti Park” at plot bearing CTS. No. 1A/1, 1A/2, 1A/3, 1A/6 of Village Anik, Chembur (M-Ward), Wadala (E), Mumbai, Maharashtra by M/s Ajmera Realty & Infra India Limited.",AJMERA REALTY & INFRA INDIA LTD,MAHARASHTRA,INFRA-2,B1,Standard ToR Granted,"Diesel, Bitumen, Lubricants, Generator Fuel",2026,Category: B1 Sector: INFRA-2 Date of Submission: 06/01/2026,Residential Cum Commercial Project,Retail Regional Manager - Mumbai,022-26403955,mum.retrm@hpcl.in,"3/4, Jn. of S.V. Rd and Turner Rd Bandra (West) Mumbai, Maharashtra - 400050",Retail Regional Manager,0.0
669,Tier 3 - Monitor,45.4,False,65,37.0,0.3,0.2333333333333332,0.4,1.0,Maharashtra,SIA/MH/MIN/565838/2026,"Transfer of Environmental Clearance Sondya 1 Sand Ghat over an extent of 4.0 ha. At Bawanthadi River Bed Adjoining Gut No. 235, Village Sondya, Tehsil Tumsar, District Bhandara, Maharashtra. by M/s. Anoj kumar Agarwala",M/S ANOJ KUMAR AGARWALA,MAHARASHTRA,Non-Coal,B2,EC Granted,"Diesel, Lubricants, Transportation Fuel",2026,Category: B2 Sector: Non-Coal Mining Date of Submission: 16/01/2026,"Transfer of Environmental Clearance Sondya 1 Sand Ghat over an extent of 4.0 ha. At Bawanthadi River Bed Adjoining Gut No. 235, Village Sondya, Tehsil Tumsar, District Bhandara, Maharashtra. by M/s. Anoj kumar Agarwala",Retail Regional Manager - Mumbai,022-26403955,mum.retrm@hpcl.in,"3/4, Jn. of S.V. Rd and Turner Rd Bandra (West) Mumbai, Maharashtra - 400050",Retail Regional Manager,0.0
670,Tier 3 - Monitor,45.4,False,65,37.0,0.3,0.2333333333333332,0.4,1.0,Maharashtra,SIA/MH/MIN/565713/2026,"Transfer of Environmental Clearance Chikhali 2 Sand Ghat over an extent of 1.20 ha. At Bawanthadi River Bed Adjoining Gut No. 489, Village Chikhali, Tehsil Tumsar, District Bhandara, Maharashtra, by M/s. Anoj kumar Agarwala",M/S ANOJ KUMAR AGARWALA,MAHARASHTRA,Non-Coal,B2,EC Granted,"Diesel, Lubricants, Transportation Fuel",2026,Category: B2 Sector: Non-Coal Mining Date of Submission: 16/01/2026,"Transfer of Environmental Clearance Chikhali 2 Sand Ghat over an extent of 1.20 ha. At Bawanthadi River Bed Adjoining Gut No. 489, Village Chikhali, Tehsil Tumsar, District Bhandara, Maharashtra, by M/s. Anoj kumar Agarwala",Retail Regional Manager - Mumbai,022-26403955,mum.retrm@hpcl.in,"3/4, Jn. of S.V. Rd and Turner Rd Bandra (West) Mumbai, Maharashtra - 400050",Retail Regional Manager,0.0
671,Tier 3 - Monitor,45.4,False,65,37.0,0.3,0.2333333333333332,0.4,1.0,Maharashtra,SIA/MH/MIN/565824/2026,"Transfer of Environmental Clearance Aashti Aanjan Vihri 2 Sand Ghat over an extent of 3.8 ha. at Bawanthadi River Bed Adjoining Gut No. 1275, 1270, 1271, 1265 Village Aashti Aanjan Vihri, Tehsil Tumsar, District Bhandara, Maharashtra by M/s. Anoj kumar Agarwala",M/S ANOJ KUMAR AGARWALA,MAHARASHTRA,Non-Coal,B2,EC Granted,"Diesel, Lubricants, Transportation Fuel",2026,Category: B2 Sector: Non-Coal Mining Date of Submission: 16/01/2026,"Transfer of Environmental Clearance Aashti Aanjan Vihri 2 Sand Ghat over an extent of 3.8 ha. at Bawanthadi River Bed Adjoining Gut No. 1275, 1270, 1271, 1265 Village Aashti Aanjan Vihri, Tehsil Tumsar, District Bhandara, Maharashtra by M/s. Anoj kumar Agarwala",Retail Regional Manager - Mumbai,022-26403955,mum.retrm@hpcl.in,"3/4, Jn. of S.V. Rd and Turner Rd Bandra (West) Mumbai, Maharashtra - 400050",Retail Regional Manager,0.0
672,Tier 3 - Monitor,45.4,False,72,34.0,0.3,0.0,0.6,1.0,Madhya Pradesh,IA/MP/INFRA2/561689/2026,Samdariya Avenue Residential/Commercial Complex Jabalpur,SAMDARIYA BUILDERS (INDIA) PRIVATE LIMITED,MADHYA PRADESH,INFRA-2,B1,Proposal pulled back (withdrawn),"Diesel, Bitumen, Lubricants, Generator Fuel",2026,Category: B1 Sector: INFRA-2 Date of Submission: 07/01/2026,Residential/Commercial Complex,Retail Regional Manager - Bhopal,0755-4274021,bhop.retrm@hpcl.in,"Gautam Nagar P.O. Govindpura, Bhopal, Madhya Pradesh - 462023",Retail Regional Manager,0.0
673,Tier 3 - Monitor,45.4,False,65,37.0,0.3,0.2333333333333332,0.4,1.0,Maharashtra,SIA/MH/MIN/565756/2026,"Transfer of Environmental Clearance Lobhi 1 Sand Ghat over an extent of 2.7 ha. At Bawanthadi River Bed Adjoining Gut No. 258, 259, 260, 261, 262, Village Lobhi, Tehsil Tumsar, District Bhandara, Maharashtra by M/s. Anoj kumar Agarwala",M/S ANOJ KUMAR AGARWALA,MAHARASHTRA,Non-Coal,B2,EC Granted,"Diesel, Lubricants, Transportation Fuel",2026,Category: B2 Sector: Non-Coal Mining Date of Submission: 16/01/2026,"Transfer of Environmental Clearance Lobhi 1 Sand Ghat over an extent of 2.7 ha. At Bawanthadi River Bed Adjoining Gut No. 258, 259, 260, 261, 262, Village Lobhi, Tehsil Tumsar, District Bhandara, Maharashtra by M/s. Anoj kumar Agarwala",Retail Regional Manager - Mumbai,022-26403955,mum.retrm@hpcl.in,"3/4, Jn. of S.V. Rd and Turner Rd Bandra (West) Mumbai, Maharashtra - 400050",Retail Regional Manager,0.0
674,Tier 3 - Monitor,45.4,False,72,34.0,0.3,0.0,0.6,1.0,Maharashtra,SIA/MH/INFRA2/562336/2026,"Environment Clearance for Proposed ""Residential & Commercial"" project on Plot No. bearing CTS NO. 1406-A/14 of Village Malad(South) at Malad (West) By Radhakrishna Properties Pvt. Ltd.",RADHAKRISHNA PROPERTIES PRIVATE LIMITED,MAHARASHTRA,INFRA-2,B1,Standard ToR Granted,"Diesel, Bitumen, Lubricants, Generator Fuel",2026,Category: B1 Sector: INFRA-2 Date of Submission: 08/01/2026,Proposed project is Residential & Commercial project.,Retail Regional Manager - Mumbai,022-26403955,mum.retrm@hpcl.in,"3/4, Jn. of S.V. Rd and Turner Rd Bandra (West) Mumbai, Maharashtra - 400050",Retail Regional Manager,0.0
675,Tier 3 - Monitor,45.4,False,65,37.0,0.3,0.2333333333333332,0.4,1.0,Maharashtra,SIA/MH/MIN/565852/2026,"Transfer of Environmental Clearance Chargaon Sand Ghat over an extent of 4.03 ha. At Wainganga River Bed Adjoining Gut No. 10, 11, 16, 17, Village Chargaon, Tehsil Tumsar, District Bhandara, Maharashtra. by M/s. Anoj kumar Agarwala",M/S ANOJ KUMAR AGARWALA,MAHARASHTRA,Non-Coal,B2,EC Granted,"Diesel, Lubricants, Transportation Fuel",2026,Category: B2 Sector: Non-Coal Mining Date of Submission: 16/01/2026,"Transfer of Environmental Clearance Chargaon Sand Ghat over an extent of 4.03 ha. At Wainganga River Bed Adjoining Gut No. 10, 11, 16, 17, Village Chargaon, Tehsil Tumsar, District Bhandara, Maharashtra. by M/s. Anoj kumar Agarwala",Retail Regional Manager - Mumbai,022-26403955,mum.retrm@hpcl.in,"3/4, Jn. of S.V. Rd and Turner Rd Bandra (West) Mumbai, Maharashtra - 400050",Retail Regional Manager,0.0
676,Tier 3 - Monitor,45.4,False,65,37.0,0.3,0.2333333333333332,0.4,1.0,Maharashtra,SIA/MH/MIN/565826/2026,"Transfer of Environmental Clearance Dhutera 1 Sand Ghat over an extent of 3.36 ha. At Bawanthadi River Bed Adjoining Gut No. 63, 65, 62, 66, Village Dhutera, Tehsil Tumsar, District Bhandara, Maharashtra by M/s. Anoj kumar Agarwala",M/S ANOJ KUMAR AGARWALA,MAHARASHTRA,Non-Coal,B2,EC Granted,"Diesel, Lubricants, Transportation Fuel",2026,Category: B2 Sector: Non-Coal Mining Date of Submission: 16/01/2026,"Transfer of Environmental Clearance Dhutera 1 Sand Ghat over an extent of 3.36 ha. At Bawanthadi River Bed Adjoining Gut No. 63, 65, 62, 66, Village Dhutera, Tehsil Tumsar, District Bhandara, Maharashtra by M/s. Anoj kumar Agarwala",Retail Regional Manager - Mumbai,022-26403955,mum.retrm@hpcl.in,"3/4, Jn. of S.V. Rd and Turner Rd Bandra (West) Mumbai, Maharashtra - 400050",Retail Regional Manager,0.0
677,Tier 3 - Monitor,45.4,False,65,37.0,0.3,0.2333333333333332,0.4,1.0,Maharashtra,SIA/MH/MIN/565851/2026,"Transfer of Environmental Clearance Warpindkepar Sand Ghat over an extent of 3.5 ha. At Bawanthadi River Bed Adjoining Gut No. 339, 340, 412, 413, 414, Village Warpindkepar, Tehsil Tumsar, District Bhandara, Maharashtra. by M/s. Anoj kumar Agarwala",M/S ANOJ KUMAR AGARWALA,MAHARASHTRA,Non-Coal,B2,EC Granted,"Diesel, Lubricants, Transportation Fuel",2026,Category: B2 Sector: Non-Coal Mining Date of Submission: 16/01/2026,"Transfer of Environmental Clearance Warpindkepar Sand Ghat over an extent of 3.5 ha. At Bawanthadi River Bed Adjoining Gut No. 339, 340, 412, 413, 414, Village Warpindkepar, Tehsil Tumsar, District Bhandara, Maharashtra. by M/s. Anoj kumar Agarwala",Retail Regional Manager - Mumbai,022-26403955,mum.retrm@hpcl.in,"3/4, Jn. of S.V. Rd and Turner Rd Bandra (West) Mumbai, Maharashtra - 400050",Retail Regional Manager,0.0
678,Tier 3 - Monitor,45.4,False,65,37.0,0.3,0.2333333333333332,0.4,1.0,Maharashtra,SIA/MH/MIN/565747/2026,"Transfer of Environmental Clearance Dongri Buzurg 2 Sand Ghat over an extent of 1.62 ha. At Bawanthadi River Bed Adjoining Gut No. 263, 264, 265, 356, 352, 353, 354, 355, Village Dongri Buzurg, Tehsil Tumsar, District Bhandara, Maharashtra, by M/s. Anoj kumar Agarwala",M/S ANOJ KUMAR AGARWALA,MAHARASHTRA,Non-Coal,B2,EC Granted,"Diesel, Lubricants, Transportation Fuel",2026,Category: B2 Sector: Non-Coal Mining Date of Submission: 16/01/2026,"Transfer of Environmental Clearance Dongri Buzurg 2 Sand Ghat over an extent of 1.62 ha. At Bawanthadi River Bed Adjoining Gut No. 263, 264, 265, 356, 352, 353, 354, 355, Village Dongri Buzurg, Tehsil Tumsar, District Bhandara, Maharashtra, by M/s. Anoj kumar Agarwala",Retail Regional Manager - Mumbai,022-26403955,mum.retrm@hpcl.in,"3/4, Jn. of S.V. Rd and Turner Rd Bandra (West) Mumbai, Maharashtra - 400050",Retail Regional Manager,0.0
679,Tier 3 - Monitor,45.4,False,72,34.0,0.3,0.1333333333333333,0.4,1.0,Madhya Pradesh,SIA/MP/INFRA2/565453/2026,"Centre for Disability Sports at Survey No. 109,110,111,112,113,114 and 117 village Swejfarm, Tehsil Jagnapura District Gwalior, (MP)",MINISTRY OF SOCIAL JUSTICE AND EMPOWERMENT GOVT OF INDIA,MADHYA PRADESH,INFRA-2,B2,EDS raised,"Diesel, Bitumen, Lubricants, Generator Fuel",2026,Category: B2 Sector: INFRA-2 Date of Submission: 13/01/2026,Earlier environment clearance was granted vide File No. 7948/SEIAA/21 dated 31.03.2021 on concept basis for the net plot area 106494.20 sqm and built-up area 38011.19 sqm. Now the construction of the project is completed. We are now submitting application as per actual status of the project. Built-up area decreases from 38011.19 sqm to 34638.74 sqm and water requirement of the project decreases and STP of the project is reduced from 225 KLD to 165 KLD. Consent to operate has been obtained vide c,Retail Regional Manager - Bhopal,0755-4274021,bhop.retrm@hpcl.in,"Gautam Nagar P.O. Govindpura, Bhopal, Madhya Pradesh - 462023",Retail Regional Manager,0.0
680,Tier 3 - Monitor,45.4,False,72,34.0,0.3,0.0,0.6,1.0,Madhya Pradesh,SIA/MP/INFRA1/555862/2026,"Smart Industrial Township Ratlam"" in Proposed Investment Region Development & Management Scheme at: District & Tehsil: Ratlam, Madhya Pradesh by MP Industrial Development Corporation Ltd.",MP Industrial Development Corportion Ltd.,MADHYA PRADESH,INFRA-1,B1,Standard ToR Granted,"Bitumen, Diesel, Road Construction Materials",2026,Category: B1 Sector: INFRA-1 Date of Submission: 02/01/2026,"MPIDC Ltd, RO Indore, a publicly traded company and a subsidiary of MP State Industrial Development Corporation (MPSIDC) in Bhopal, was established with the primary goal of fostering the growth of Industrial Growth Centers in the Indore Region. In pursuit of this objective, MPIDC, RO Indore has undertaken the development of Ratlam Investment Region under the ""Investment Region Development and Management Scheme."" The project's overarching mission is to create a globally competitive Industrial Tow",Retail Regional Manager - Bhopal,0755-4274021,bhop.retrm@hpcl.in,"Gautam Nagar P.O. Govindpura, Bhopal, Madhya Pradesh - 462023",Retail Regional Manager,0.0
681,Tier 3 - Monitor,45.4,False,65,37.0,0.3,0.2333333333333332,0.4,1.0,Maharashtra,SIA/MH/MIN/565849/2026,"Transfer of Environmental Clearance Sukli de Sand Ghat over an extent of 2.0 ha. At Wainganga River Bed Adjoining Gut No. 451, 450, 446, Village Sukli de, Tehsil Tumsar, District Bhandara, Maharashtra. by M/s. Anoj kumar Agarwala",M/S ANOJ KUMAR AGARWALA,MAHARASHTRA,Non-Coal,B2,EC Granted,"Diesel, Lubricants, Transportation Fuel",2026,Category: B2 Sector: Non-Coal Mining Date of Submission: 16/01/2026,"Transfer of Environmental Clearance Sukli de Sand Ghat over an extent of 2.0 ha. At Wainganga River Bed Adjoining Gut No. 451, 450, 446, Village Sukli de, Tehsil Tumsar, District Bhandara, Maharashtra. by M/s. Anoj kumar Agarwala",Retail Regional Manager - Mumbai,022-26403955,mum.retrm@hpcl.in,"3/4, Jn. of S.V. Rd and Turner Rd Bandra (West) Mumbai, Maharashtra - 400050",Retail Regional Manager,0.0
