ID,Priority_Tier,Final_Score,High_Urgency_Flag,Lead_Score,Enhanced_Score,Intent_Signal,Freshness_Score,Size_Score,Proximity_Score,State,Proposal No.,Project Name,Project Proponent,Location,Sector,Category,Proposal Status,Recommended_Products,Submission_Year,Other Details,Project_Description,Officer_Name,Officer_Phone,Officer_Email,Officer_Address,Officer_Role,Officer_Distance_KM
199,Tier 2 - High Priority,61.9,False,85,52.0,0.3,0.7333333333333334,0.4,1.0,Madhya Pradesh,SIA/MP/MIN/567330/2026,Ghutehi Marble Quarry,RAJAS MARBLE INDUSTRIES,MADHYA PRADESH,Non-Coal,B1,EDS raised,"Diesel, Lubricants, Transportation Fuel",2026,Category: B1 Sector: Non-Coal Mining Date of Submission: 31/01/2026,"It is a Marble quarry with a production capacity of Max. 5,112 Cu.mt/Year Marble, Max. 20,453 Cu.mt/Year Saleable waste and Max. 65,027 Cu.mt/Year Saleable OB having a lease area of 4.28 hectares , previously EC was issued by DEIAA Jabalpur at Khasra No.- 222/1, 223/1, 233 & 224 Village - Ghutehi, Tehsil- Sihora, District- Jabalpur (M.P.). Then we have applied a new application in Form-2 for fresh EC in SEIAA as per SEIAA policy decision taken in SEIAA agenda 766th Dated 11/01/2023 which is for ",Retail Regional Manager - Bhopal,0755-4274021,bhop.retrm@hpcl.in,"Gautam Nagar P.O. Govindpura, Bhopal, Madhya Pradesh - 462023",Retail Regional Manager,0.0
200,Tier 2 - High Priority,61.9,False,85,52.0,0.3,0.8666666666666667,0.4,0.6,Maharashtra,SIA/MH/MIN/568000/2026,"Environmental Clearacne for the Basalt stone quarry of Shri. Tukaram Rambhau Pawar located at gut no. 605 part, Village Pokharni (Nru.), Taluka Parbhani, District Parbhani",TUKARAM PAWAR,MAHARASHTRA,Non-Coal,B2,Under Verification,"Diesel, Lubricants, Transportation Fuel",2026,Category: B2 Sector: Non-Coal Mining Date of Submission: 04/02/2026,"Environmental Clearacne for the Basalt stone quarry of Shri. Tukaram Rambhau Pawar located at gut no. 605 part, Village Pokharni (Nru.), Taluka Parbhani, District Parbhani",Retail Regional Manager - Mumbai,022-26403955,mum.retrm@hpcl.in,"3/4, Jn. of S.V. Rd and Turner Rd Bandra (West) Mumbai, Maharashtra - 400050",Retail Regional Manager,0.0
201,Tier 2 - High Priority,61.9,False,85,52.0,0.3,0.8,0.4,0.8,Uttar Pradesh,SIA/UP/MIN/567685/2026,"Transfer of Environmental Clearance for Sand/Morrum Mining project from Gata No.- 2/1, 473Mi, 474 & 659 lease area 4.21 ha, Village- Gopra, Tehsil- Naraini, District- Banda, Uttar Pradesh of M/s Murli Construction",Vaibhav Singh,UTTAR PRADESH,Non-Coal,B2,Under Verification,"Diesel, Lubricants, Transportation Fuel",2026,Category: B2 Sector: Non-Coal Mining Date of Submission: 02/02/2026,"Transfer of Environmental Clearance for Sand/Morrum Mining project from Gata No.- 2/1, 473Mi, 474 & 659 lease area 4.21 ha, Village- Gopra, Tehsil- Naraini, District- Banda, Uttar Pradesh of M/s Murli Construction",Retail Regional Manager - Lucknow,0522-2309581,lucknow.retrm@hpcl.in,"Plot No. 1, Nehru Enclave, Gomti Nagar, Lucknow, Uttar Pradesh - 226010",Retail Regional Manager,0.0
202,Tier 2 - High Priority,61.9,False,85,52.0,0.3,0.8333333333333334,0.4,0.7,West Bengal,SIA/WB/MIN/566529/2026,Metayala Quartz Mine,MAITHAN ALLOYS LIMITED,WEST BENGAL,Non-Coal,B2,Under Verification,"Diesel, Lubricants, Transportation Fuel",2026,Category: B2 Sector: Non-Coal Mining Date of Submission: 03/02/2026,"Metayala Quartz Mine (Applicant- Maithan Alloys Limited), over an area of 1.845 Ha is situated in Village- Metayala, Block- Manbazar-I, District- Purulia & State West Bengal. It is an existing mine. A Letter of Intent (LoI) for Metayala Quartz Mine (Quartz block Auction ID 2O17_WB_533) was issued on 27.06.2O18 for Maithan Alloys Limited via Memo No. VI/1559(1)/2800/M/2O17 Dated, Purulia the, 27.06.2O18. The Environment Clearance was granted by District Level Environment Impact Assessment Authori",Regional Manager - Kolkata,+91-9547535867,kolkata.retrm@hpcl.in,"2ND FLOOR, No-6, Church Lane, Bbd Bag, Kolkata-700001, West Bengal",Regional Manager,0.0
203,Tier 2 - High Priority,61.9,False,85,52.0,0.3,0.7333333333333334,0.4,1.0,Madhya Pradesh,SIA/MP/MIN/556581/2026,GHUTEHI MARBLE DEPOSIT QUARRY,RAJAS MARBLE INDUSTRIES,MADHYA PRADESH,Non-Coal,B1,EDS raised,"Diesel, Lubricants, Transportation Fuel",2026,Category: B1 Sector: Non-Coal Mining Date of Submission: 31/01/2026,"It is a Marble quarry with a production capacity of Max. 3801 cubic meter per year Marble & Max. 7059 cubic meter per year of Saleable waste having a lease area of 4.80 hectares , previously EC was issued by DEIAA Jabalpur at khasra No.– 226/1, 226/2, 227, 228 Village- Ghutehi, Tehsil- Majhauli, District- Jabalpur (M.P.). Then we have applied a new application in Form-2 for fresh EC in SEIAA as per SEIAA policy decision taken in SEIAA agenda 766th Dated 11/01/2023 which is for 0 to 5 hectares wh",Retail Regional Manager - Bhopal,0755-4274021,bhop.retrm@hpcl.in,"Gautam Nagar P.O. Govindpura, Bhopal, Madhya Pradesh - 462023",Retail Regional Manager,0.0
204,Tier 2 - High Priority,61.8,False,80,54.0,0.3,0.8,0.4,1.0,Maharashtra,SIA/MH/MIN/567617/2026,"Transfer of EC of Sand Ghat at Ajarsonda , River Purna, Vill Ajarsonda Tq. Aundha (Nag.) Dist. Hingoli Nearest Gut no 403,405,416,417,426,427,430,435,437,466,467,474,475,476,404, Area-1.05 Ha, Qty-1855 Brass, in the name of M/s Siddhant Building Materials Suppliers, Prop Mr. Sunil Arun Narwade",SUNIL ARUN NARWADE,MAHARASHTRA,Non-Coal,B2,Referred to SEIAA,"Diesel, Lubricants, Transportation Fuel",2026,Category: B2 Sector: Non-Coal Mining Date of Submission: 02/02/2026,"Transfer of EC of Sand Ghat at Ajarsonda , River Purna, Vill Ajarsonda Tq. Aundha (Nag.) Dist. Hingoli Nearest Gut no 403,405,416,417,426,427,430,435,437,466,467,474,475,476,404, Area-1.05 Ha, Qty-1855 Brass, in the name of M/s Siddhant Building Materials Suppliers, Prop Mr. Sunil Arun Narwade",Retail Regional Manager - Mumbai,022-26403955,mum.retrm@hpcl.in,"3/4, Jn. of S.V. Rd and Turner Rd Bandra (West) Mumbai, Maharashtra - 400050",Retail Regional Manager,0.0
205,Tier 2 - High Priority,61.8,False,80,54.0,0.3,0.8,0.4,1.0,Maharashtra,SIA/MH/MIN/567683/2026,"Application of Transfer of Environmental Clearance for Proposal of Umbarkhed Sand Ghat Tq. Tiosa Dist. Amravati, Nearest Gut no 51 and 52, Area-1.50 Ha from District Mining Officer, Amaravati to Mr. Akshay Prakash Patmase",akshay patmase,MAHARASHTRA,Non-Coal,B2,Referred to SEIAA,"Diesel, Lubricants, Transportation Fuel",2026,Category: B2 Sector: Non-Coal Mining Date of Submission: 02/02/2026,Transfer of Environmental Clearance for Proposal of Umbarkhed Sand Ghat,Retail Regional Manager - Mumbai,022-26403955,mum.retrm@hpcl.in,"3/4, Jn. of S.V. Rd and Turner Rd Bandra (West) Mumbai, Maharashtra - 400050",Retail Regional Manager,0.0
206,Tier 2 - High Priority,61.8,False,80,54.0,0.3,0.9,0.4,0.7,Maharashtra,SIA/MH/MIN/568020/2026,"Environmental Clearance for the Basalt stone Quarry of Shri. Shubham Vasantrao Dhure located at gut no. 344/1 part, Village Uttur, Taluka Ajara, District Kolhapur",dhure shubham vasantrav,MAHARASHTRA,Non-Coal,B2,Proposal Accepted and Referred to SEAC,"Diesel, Lubricants, Transportation Fuel",2026,Category: B2 Sector: Non-Coal Mining Date of Submission: 05/02/2026,"Environmental Clearance for the Basalt stone Quarry of Shri. Shubham Vasantrao Dhure located at gut no. 344/1 part, Village Uttur, Taluka Ajara, District Kolhapur",Retail Regional Manager - Mumbai,022-26403955,mum.retrm@hpcl.in,"3/4, Jn. of S.V. Rd and Turner Rd Bandra (West) Mumbai, Maharashtra - 400050",Retail Regional Manager,0.0
207,Tier 2 - High Priority,61.8,False,80,54.0,0.3,0.8,0.4,1.0,Maharashtra,SIA/MH/MIN/567639/2026,"Transfer of Environmental Clearance of Dhaulgaon Sand Ghat, Hingoli from District Mining Officer, Hingoli to Kapse Sonali Pramod",kapse sonali pramod,MAHARASHTRA,Non-Coal,B2,Referred to SEIAA,"Diesel, Lubricants, Transportation Fuel",2026,Category: B2 Sector: Non-Coal Mining Date of Submission: 02/02/2026,"Application for Transfer of EC of Dhaulgaon Sand Ghat, Hingoli located at Gat No. 15, 14, 13, 9, 8, 4, 3, 2, 212, 211, 209, 207, 208 at Dhaulgaon, Tal. Basmath, Dist. Hingoli from the District Mining Officer, Hingoli, to Kapse Sonali Pramod",Retail Regional Manager - Mumbai,022-26403955,mum.retrm@hpcl.in,"3/4, Jn. of S.V. Rd and Turner Rd Bandra (West) Mumbai, Maharashtra - 400050",Retail Regional Manager,0.0
208,Tier 2 - High Priority,61.8,False,80,54.0,0.3,0.8,0.4,1.0,Maharashtra,SIA/MH/MIN/567605/2026,"Transfer of EC of Sand Ghat at Tapowan , River Purna, Vill Tapowan Tq. Aundha (Nag.) Dist. Hingoli Nearest Gut no 13,21,25,26,27,28,29,30,31,284,287,288,289,290, Area-1.00 Ha, Qty-1767 Brass, in the name of M/s Siddhant Building Materials Suppliers, Prop Mr. Sunil Arun Narwade",SUNIL ARUN NARWADE,MAHARASHTRA,Non-Coal,B2,Referred to SEIAA,"Diesel, Lubricants, Transportation Fuel",2026,Category: B2 Sector: Non-Coal Mining Date of Submission: 02/02/2026,"Transfer of EC of Sand Ghat at Tapowan , River Purna, Vill Tapowan Tq. Aundha (Nag.) Dist. Hingoli Nearest Gut no 13,21,25,26,27,28,29,30,31,284,287,288,289,290, Area-1.00 Ha, Qty-1767 Brass, in the name of M/s Siddhant Building Materials Suppliers, Prop Mr. Sunil Arun Narwade",Retail Regional Manager - Mumbai,022-26403955,mum.retrm@hpcl.in,"3/4, Jn. of S.V. Rd and Turner Rd Bandra (West) Mumbai, Maharashtra - 400050",Retail Regional Manager,0.0
209,Tier 2 - High Priority,61.7,False,75,56.0,0.3,0.7333333333333334,0.6,1.0,Madhya Pradesh,SIA/MP/MIN/479736/2026,Khod Limestone Mine 58.431 ha,SAGAR CEMENTS (M) PRIVATE LIMITED,MADHYA PRADESH,Non-Coal,B1,DELISTED BY SYSTEM (at : ),"Diesel, Lubricants, Transportation Fuel",2026,Category: B1 Sector: Non-Coal Mining Date of Submission: 31/01/2026,Name change of the Company from Satguru Cement Private Limited to Sagar Cements(M) Private Limited,Retail Regional Manager - Bhopal,0755-4274021,bhop.retrm@hpcl.in,"Gautam Nagar P.O. Govindpura, Bhopal, Madhya Pradesh - 462023",Retail Regional Manager,0.0
210,Tier 2 - High Priority,61.7,False,82,53.0,0.3,0.6333333333333333,0.6,1.0,Maharashtra,SIA/MH/INFRA2/561006/2026,"Proposed Mixed used project on plot bearing CTS No. 2, 2/1, 2/2, 2/3, 2/4, 2/5, 2/6, 2/7, 2/8, 2/9, 2/10, 2/11, 2/12, 2/13, 2/14, 2/15, 3, 4, 12(pt.), 12/1 at village Aakse, CTS Nos. 82,130,131,132, 132/1, 132/2, 132/3, 132/4, 135/5, 132/6, 132/7, 133, 134 at village Marve and CTS Nos. 3530(pt), 3551, 3552 & 3553 at village Malvani in Mumbai. By M/s. India Farmers Private Limited.",india farmers private limited,MAHARASHTRA,INFRA-2,B1,EDS raised,"Diesel, Bitumen, Lubricants, Generator Fuel",2026,Category: B1 Sector: INFRA-2 Date of Submission: 28/01/2026,The proposed project is a Residential cum Commercial development.,Retail Regional Manager - Mumbai,022-26403955,mum.retrm@hpcl.in,"3/4, Jn. of S.V. Rd and Turner Rd Bandra (West) Mumbai, Maharashtra - 400050",Retail Regional Manager,0.0
211,Tier 2 - High Priority,61.7,False,75,56.0,0.7,0.3333333333333333,0.4,1.0,Maharashtra,SIA/MH/MIN/565983/2026,"Amalgamation of Gumgaon and Khodegaon Manganese Mine (Amalgamated Lease Area - 212.736 ha) and Expansion in Manganese Ore production capacity from 3,05,200 TPA to 6,05,200 TPA",MOIL LIMITED,MAHARASHTRA,Non-Coal,B1,Pending at MS SEIAA,"Diesel, Lubricants, Transportation Fuel",2026,Category: B1 Sector: Non-Coal Mining Date of Submission: 19/01/2026,"Amalgamation of Gumgaon and Khodegaon Manganese Mine (Amalgamated Lease Area - 212.736 ha) and Expansion in Manganese Ore production capacity from 3,05,200 TPA to 6,05,200 TPA at Village: Gumgaon, Khodegaon, Tegai, Khapa, Khapapeth & Rajna, Tehsil: Saoner, District: Nagpur, Maharashtra",Retail Regional Manager - Mumbai,022-26403955,mum.retrm@hpcl.in,"3/4, Jn. of S.V. Rd and Turner Rd Bandra (West) Mumbai, Maharashtra - 400050",Retail Regional Manager,0.0
212,Tier 2 - High Priority,61.7,False,75,56.0,0.3,0.8666666666666667,0.4,1.0,Madhya Pradesh,SIA/MP/MIN/567831/2026,Temni Stone (Gitti & M-Sand) Quarry,RAM SAHU,MADHYA PRADESH,Non-Coal,B2,EDS raised,"Diesel, Lubricants, Transportation Fuel",2026,Category: B2 Sector: Non-Coal Mining Date of Submission: 04/02/2026,"Temni Stone (Gitti & M-Sand) Quarry is situated at Village: Temni, Tehsil: Pandhurna, District: Pandhurna and State: Madhya Pradesh over an area of 4.0 Ha. Quarry Lease Sanctioned to Ram Sahu by Collector Office (Khanij Shakha) Pandhurna (M.P), A Vide Order No. 7/0055/2025-O/OMINING-PRNA-COLL-(I/405819/2025) dated 31/07/2025.",Retail Regional Manager - Bhopal,0755-4274021,bhop.retrm@hpcl.in,"Gautam Nagar P.O. Govindpura, Bhopal, Madhya Pradesh - 462023",Retail Regional Manager,0.0
213,Tier 2 - High Priority,61.4,False,60,62.0,0.3,0.8666666666666667,0.7,1.0,West Bengal,IA/WB/IND1/567940/2026,Application for “No Increase in Pollution Load” Certificate for Increase in Production capacity of Pelletization Plant with Modification in Equipment,TECH AIC DRI PELLETS PRIVATE LIMITED,WEST BENGAL,Date,A,INTIMATED,"Diesel, Lubricants",2026,Category: A Sector: Date of Submission: 04/02/2026,It is a proposal for “No Increase in Pollution Load” Certificate for Increase in Production capacity of Pelletization Plant with Modification in Equipment,Regional Manager - Kolkata,+91-9547535867,kolkata.retrm@hpcl.in,"2ND FLOOR, No-6, Church Lane, Bbd Bag, Kolkata-700001, West Bengal",Regional Manager,0.0
214,Tier 2 - High Priority,61.2,False,85,51.0,0.3,0.4333333333333333,0.8,1.0,Uttar Pradesh,SIA/UP/MIN/566413/2026,"Proposed Project of “Sand/Morrum Mining” at Gata No. 431/1 (Khand No. 05), Mining Lease Area 23.0 Hectares, Village: Kanwara, Tehsil: Banda, District Banda, Uttar Pradesh, Prop- Shri Aman Sethi",AMAN SETHI,UTTAR PRADESH,Non-Coal,B1,ADS Raised,"Diesel, Lubricants, Transportation Fuel",2026,Category: B1 Sector: Non-Coal Mining Date of Submission: 22/01/2026,"The project has been proposed by Prop- Shri Aman Sethi S/o - Shri Som Prakash Sethi R/o – S-541, Greater Kailash 2, New Delhi-342006 has been authorized as signatory for every official procedures and Environmental clearance for proposed open cast manual mining of minor mineral (Sand/ Morrum) within 2,30,000 m3 in 6 month capacity from the non-forested, non-arable, riverbed within the mining lease area.",Retail Regional Manager - Lucknow,0522-2309581,lucknow.retrm@hpcl.in,"Plot No. 1, Nehru Enclave, Gomti Nagar, Lucknow, Uttar Pradesh - 226010",Retail Regional Manager,0.0
215,Tier 2 - High Priority,61.2,False,78,54.0,0.7,0.1999999999999999,0.6,0.8,West Bengal,SIA/WB/IND1/563244/2026,"Proposed Installation of Hot & Cold Rolling Mill Plant at Plot No.220 (Full), 221 (P) & 222 (P), Nachan Road, Mouza-Kamalpur, J.L No. 47, P.S & P.O.-Durgapur, District-Paschim Bardhaman, State-West Bengal by M/s Sharp Ferro Alloys Ltd.",SHARP FERRO ALLOYS LIMITED,WEST BENGAL,Industrial,B1,EDS raised,"Furnace Oil, Diesel, Lubricants",2026,Category: B1 Sector: Industrial Projects - 1 Date of Submission: 15/01/2026,"M/s Sharp Ferro Alloys Ltd. has proposed expansion of its existing plant of liquid metal production in 1. 2 X 8 T Induction Furnace (IF) , 2. Continuous Casting Machine (CCM) : 2 Strand ,3. 1 X 7.5 & 5 X 9 MVA Submerged Arc Furnace (SAF) by installing Hot Rolling & Cold Mill Plant for production of TMT Bars/Flats & Stainless Steel (SS) at Plot No.220 (Full), 221 (P) & 222 (P), Nachan Road, Mouza-Kamalpur, J.L No. 47, P.S & P.O.-Durgapur, District-Paschim Bardhaman, State-West Bengal. Proposed Pr",Regional Manager - Kolkata,+91-9547535867,kolkata.retrm@hpcl.in,"2ND FLOOR, No-6, Church Lane, Bbd Bag, Kolkata-700001, West Bengal",Regional Manager,0.0
216,Tier 2 - High Priority,61.2,False,85,51.0,0.3,0.7,0.4,1.0,Uttar Pradesh,SIA/UP/MIN/567168/2026,"Ordinary Earth Mining project at Gata No.- 143mi, 175, 176, 177, 179, 185, Village- Dudhiya, Tehsil- Hardoi, District- Hardoi, State- Uttar Pradesh, area-1.5987 ha. by M/s Maa Enterprises, Authorized Person- Shri Sumit Kumar Singh.",SUMIT SINGH,UTTAR PRADESH,Non-Coal,B2,Under Verification,"Diesel, Lubricants, Transportation Fuel",2026,Category: B2 Sector: Non-Coal Mining Date of Submission: 30/01/2026,"Ordinary Earth Mining is proposed for Mining of Soil at Gata No.- 143mi, 175, 176, 177, 179, 185, Village- Dudhiya, Tehsil- Hardoi, District- Hardoi of State- Uttar Pradesh over an area of 1.5987 ha., being proposed by M/s Maa Enterprises, Authorized Person- Shri Sumit Kumar Singh S/o Shri Harinam Singh. The project proponent is intended to do the maximum production of 28,777 Cubic Meter for 3 Months of Mining Plan Period. The mining plan has been approved by Office of District Magistrate, Hardo",Retail Regional Manager - Lucknow,0522-2309581,lucknow.retrm@hpcl.in,"Plot No. 1, Nehru Enclave, Gomti Nagar, Lucknow, Uttar Pradesh - 226010",Retail Regional Manager,0.0
217,Tier 2 - High Priority,61.2,False,92,48.0,0.3,0.4666666666666667,0.6,1.0,Haryana,SIA/HR/INFRA2/566645/2026,"Proposed Integrated Residential Colony Plotted and Group Housing Sushant City Royale at Sector 35, 36 Karnal, Haryana",ETERNA LIVING PRIVATE LIMITED,HARYANA,INFRA-2,B1,Under Verification,"Diesel, Bitumen, Lubricants, Generator Fuel",2026,Category: B1 Sector: INFRA-2 Date of Submission: 23/01/2026,"Environmental Clearance for the said project was granted in name of “M/s Ansal Landmark (Karnal) Township Private Limited”, vide EC Identification no. EC23B039HR125485 and File No. SEIAA/HR/VIO/19/16 dated 18.01.2023 for Plot area 566167.3947 sqm. Now the name of the Company has been changed to Eterna Living Pvt. Ltd. by Ministry of Corporate Affair, Government of India dated 28.10.2025.",Retail Regional Manager - Panipat,0180-2681328,panipat.retrm@hpcl.in,"E-22, Court Road, Industrial Area, Panipat - 132101",Retail Regional Manager,0.0
218,Tier 2 - High Priority,61.2,False,92,48.0,0.3,0.4666666666666667,0.6,1.0,Maharashtra,SIA/MH/INFRA2/566380/2026,"Environmental clearance for Redevelopment of Motilal Nagar 1 Layout at Plot bearing CTS no. 2 to 17, 19, & 20 of village Goregaon, 223 to 234, 241 to 248, 249A & 249B, 250 to 259, 261 to 263, 266 of village Pahadi Goregaon, Mumbai Maharashtra by M/s. Estatevue Developers Private Limited",ESTATEVUE DEVELOPERS PRIVATE LIMITED,MAHARASHTRA,INFRA-2,B1,Under Verification,"Diesel, Bitumen, Lubricants, Generator Fuel",2026,Category: B1 Sector: INFRA-2 Date of Submission: 23/01/2026,The proposed project is Redevelopment of Motilal Nagar MN 1,Retail Regional Manager - Mumbai,022-26403955,mum.retrm@hpcl.in,"3/4, Jn. of S.V. Rd and Turner Rd Bandra (West) Mumbai, Maharashtra - 400050",Retail Regional Manager,0.0
219,Tier 2 - High Priority,61.2,False,85,51.0,0.3,0.7,0.4,1.0,Madhya Pradesh,SIA/MP/MIN/566563/2026,Rojana Stone (Gitti) Quarry Project by Ajay Baser,Ajay kumar baser,MADHYA PRADESH,Non-Coal,B1,EDS raised,"Diesel, Lubricants, Transportation Fuel",2026,Category: B1 Sector: Non-Coal Mining Date of Submission: 30/01/2026,"The proposed stone quarry, with a lease area of 1.00 hectares, was previously granted Environmental Clearance (EC) by DEIAA vide letter number 1554/DEIAA-DEAC/ 2018-19/Ratlam, dated 29/06/2018 at Survey No. 33/2, Village – Rojana, Tehsil – Jaora, District – Ratlam (MP). However, no production activities were undertaken under the earlier EC. Now we are applying for fresh EC with LOI issued by Collector (Khanij Shakha) Ratlam for mining of mineral vide letter no. 2339/Khanij/2022-23, Ratlam, dated",Retail Regional Manager - Bhopal,0755-4274021,bhop.retrm@hpcl.in,"Gautam Nagar P.O. Govindpura, Bhopal, Madhya Pradesh - 462023",Retail Regional Manager,0.0
220,Tier 2 - High Priority,61.2,False,85,51.0,0.3,0.7,0.4,1.0,Uttar Pradesh,SIA/UP/MIN/567256/2026,"“Ordinary Soil Mining Project” at Gata 378 & 363 in Village-Bhainshi Naubasta, Tehsil & District- Unnao, Uttar Pradesh. (Lease Area: 1.222 Ha.) Project Proponent - Shri Aman Dwivedi",AMAN DWIVEDI,UTTAR PRADESH,Non-Coal,B2,Under Verification,"Diesel, Lubricants, Transportation Fuel",2026,Category: B2 Sector: Non-Coal Mining Date of Submission: 30/01/2026,"“Ordinary Soil Mining Project” at Gata 378 & 363 in Village-Bhainshi Naubasta, Tehsil & District- Unnao, Uttar Pradesh. (Lease Area: 1.222 Ha.) Proposed Production: 25,295m3 for 3 Months by Project Proponent - Shri Aman Dwivedi",Retail Regional Manager - Lucknow,0522-2309581,lucknow.retrm@hpcl.in,"Plot No. 1, Nehru Enclave, Gomti Nagar, Lucknow, Uttar Pradesh - 226010",Retail Regional Manager,0.0
221,Tier 2 - High Priority,61.1,False,73,56.0,0.3,0.7333333333333334,0.6,1.0,West Bengal,IA/WB/IND1/551990/2026,"Establishment of Steel plant for the production of 4,29,000 TPA Sponge Iron, 4,12,500 TPA MS Billets, 3,96,000 TPA MS Rolled products, 1,07,136 TPA (max.) Ferro Alloys (Si-Mn, Fe-Mn, Fe-Si, Fe-Cr, Fe-Si-Cr, Pig Iron or combination of any) with 1,65,000 TPA Briquettes, 1,65,000 TPA Sinter & 80 MW Captive Power Plant along with allied facilities by M/s Maa Kali Steel & Power Private Limited at Village: Srirampur, PO & PS: Salanpur, District: Paschim Bardhaman, West Bengal.",MAA KALI STEEL & POWER PRIVATE LIMITED,WEST BENGAL,Industrial,A,Proposal pulled back (withdrawn),"Furnace Oil, Diesel, Lubricants",2026,Category: A Sector: Industrial Projects - 1 Date of Submission: 31/01/2026,"The proposed proposal is for Establishment of Steel plant for the production of 4,29,000 TPA Sponge Iron, 4,12,500 TPA MS Billets, 3,96,000 TPA MS Rolled products, 1,07,136 TPA (max.) Ferro Alloys (Si-Mn, Fe-Mn, Fe-Si, Fe-Cr, Fe-Si-Cr, Pig Iron or combination of any) with 1,65,000 TPA Briquettes, 1,65,000 TPA Sinter & 80 MW Captive Power Plant along with allied facilities",Regional Manager - Kolkata,+91-9547535867,kolkata.retrm@hpcl.in,"2ND FLOOR, No-6, Church Lane, Bbd Bag, Kolkata-700001, West Bengal",Regional Manager,0.0
222,Tier 2 - High Priority,61.0,False,68,58.0,0.3,0.9333333333333332,0.4,1.0,Haryana,IA/HR/IND3/549175/2026,Proposed establishment of Resin Manufacturing Unit Within the Existing Plywood Manufacturing industry of M/s. Heera Products,BALBANT SINGH,HARYANA,Industrial,B2,EDS Raised,"Furnace Oil, Diesel, Lubricants",2026,Category: B2 Sector: Industrial Projects - 3 Date of Submission: 06/02/2026,"The industry operates an existing plywood manufacturing facility. Until now, resin required for glue preparation has been procured from outside sources. To ensure a consistent supply and improve cost-efficiency, the industry plans to establish a Resin Manufacturing Plant within the premises for internal use. Accordingly, the project now requires obtaining Environmental Clearance for the proposed resin production",Retail Regional Manager - Panipat,0180-2681328,panipat.retrm@hpcl.in,"E-22, Court Road, Industrial Area, Panipat - 132101",Retail Regional Manager,0.0
223,Tier 2 - High Priority,61.0,False,82,52.0,0.3,0.7333333333333334,0.4,1.0,Haryana,SIA/HR/INFRA2/567506/2026,Proposed IT/ITES Project,Devkriti Infra Global Private Limited,HARYANA,INFRA-2,B2,Under Verification,"Diesel, Bitumen, Lubricants, Generator Fuel",2026,Category: B2 Sector: INFRA-2 Date of Submission: 31/01/2026,Proposed project consists of development of one IT/ITES building having 3B+G+S+7 floors along with the required facilities.,Retail Regional Manager - Panipat,0180-2681328,panipat.retrm@hpcl.in,"E-22, Court Road, Industrial Area, Panipat - 132101",Retail Regional Manager,0.0
224,Tier 2 - High Priority,61.0,False,68,58.0,0.3,0.9333333333333332,0.4,1.0,Haryana,IA/HR/IND3/548902/2026,Proposed establishment of Resin Manufacturing Unit Within the Existing Plywood Manufacturing industry of M/s. Metro Plywood Pvt. Ltd.,METRO PLYWOOD PRIVATE LIMITED,HARYANA,Industrial,B2,EDS Raised,"Furnace Oil, Diesel, Lubricants",2026,Category: B2 Sector: Industrial Projects - 3 Date of Submission: 06/02/2026,Proposed establishment of Resin Manufacturing Unit Within the Existing Plywood Manufacturing Industry of M/s. Metro Plywood Pvt. Ltd.,Retail Regional Manager - Panipat,0180-2681328,panipat.retrm@hpcl.in,"E-22, Court Road, Industrial Area, Panipat - 132101",Retail Regional Manager,0.0
225,Tier 2 - High Priority,61.0,False,82,52.0,0.3,0.7333333333333334,0.4,1.0,Uttar Pradesh,SIA/UP/INFRA2/567504/2026,"Proposed Logistics Park on Khasra Nos. 212 to 218, 220-C, 220-D, 220-E, 221 to 238, 239-A to 239-F, 242, 243, 244-A, 244-B, 245-A to 245-C, 246 to 255, 256-C, 256-D to 256-I, and 257 to 260, situated at Village - Rasulpur, Tehsil - Hasanganj, District - Unnao, Uttar Pradesh by M/s Meteor Warehouse Pvt. Ltd",METEORWARE HOUSE PRIVATE LIMITED,UTTAR PRADESH,INFRA-2,B2,Under Verification,"Diesel, Bitumen, Lubricants, Generator Fuel",2026,Category: B2 Sector: INFRA-2 Date of Submission: 31/01/2026,"Meteor Warehouse Pvt. Ltd. proposes to develop a logistics park, on Khasra Nos. 212 to 218, 220-C, 220-D, 220-E, 221 to 238, 239-A to 239-F, 242, 243, 244-A, 244-B, 245-A to 245-C, 246 to 255, 256-C, 256-D to 256-I, and 257 to 260, situated at Village Rasulpur, Tehsil Hasanganj, District Unnao, Uttar Pradesh. The project is proposed over a total plot area of 105,255.00 sqm. with a total built-up area of 56,733.83 sqm.",Retail Regional Manager - Lucknow,0522-2309581,lucknow.retrm@hpcl.in,"Plot No. 1, Nehru Enclave, Gomti Nagar, Lucknow, Uttar Pradesh - 226010",Retail Regional Manager,0.0
